{
  "$schema": "https://json-schema.org/draft/2020-12/schema",
  "title": "DiagramGraph",
  "description": "Schema for a flowchart graph",
  "type": "object",
  "properties": {
    "diagram_type": {
      "type": "string",
      "description": "The type of diagram"
    },
    "nodes": {
      "type": "array",
      "items": {
        "properties": {
          "id": {
            "description": "Node id",
            "title": "Id",
            "type": "string"
          },
          "bounding_box": {
            "anyOf": [
              {
                "items": {},
                "type": "array"
              },
              {
                "type": "null"
              }
            ],
            "default": null,
            "description": "Node bounding_box",
            "title": "Bounding Box"
          },
          "label": {
            "description": "Node label",
            "title": "Label",
            "type": "string"
          },
          "confidence": {
            "anyOf": [
              {
                "type": "string"
              },
              {
                "type": "null"
              }
            ],
            "default": null,
            "description": "Node confidence",
            "title": "Confidence"
          },
          "shape": {
            "anyOf": [
              {
                "type": "string"
              },
              {
                "type": "null"
              }
            ],
            "default": null,
            "description": "Node shape",
            "title": "Shape"
          },
          "element_type": {
            "anyOf": [
              {
                "type": "string"
              },
              {
                "type": "null"
              }
            ],
            "default": null,
            "description": "Node element_type",
            "title": "Element Type"
          },
          "parent_id": {
            "anyOf": [
              {
                "type": "string"
              },
              {
                "type": "null"
              }
            ],
            "default": null,
            "description": "Node parent_id",
            "title": "Parent Id"
          },
          "bq_function": {
            "anyOf": [
              {
                "type": "string"
              },
              {
                "type": "null"
              }
            ],
            "default": null,
            "description": "Node bq_function",
            "title": "Bq Function"
          }
        },
        "required": [
          "id",
          "label"
        ],
        "title": "GraphNode",
        "type": "object"
      },
      "description": "List of graph nodes"
    },
    "edges": {
      "type": "array",
      "items": {
        "properties": {
          "target": {
            "description": "Edge target",
            "title": "Target",
            "type": "string"
          },
          "source": {
            "description": "Edge source",
            "title": "Source",
            "type": "string"
          },
          "confidence": {
            "anyOf": [
              {
                "type": "string"
              },
              {
                "type": "null"
              }
            ],
            "default": null,
            "description": "Edge confidence",
            "title": "Confidence"
          },
          "id": {
            "description": "Edge id",
            "title": "Id",
            "type": "string"
          },
          "label": {
            "anyOf": [
              {
                "type": "string"
              },
              {
                "type": "null"
              }
            ],
            "default": null,
            "description": "Edge label",
            "title": "Label"
          }
        },
        "required": [
          "target",
          "source",
          "id"
        ],
        "title": "GraphEdge",
        "type": "object"
      },
      "description": "List of graph edges"
    },
    "metadata": {
      "type": "object",
      "description": "Additional metadata about the graph"
    }
  },
  "required": [
    "diagram_type",
    "nodes",
    "edges"
  ]
}